StockCode,Description,ProductCategory,TotalQuantity,TotalRevenue
90046,WHITE WITH METAL BAG CHARM,Accessories,3.0,14.85
90048,GREEN WITH METAL BAG CHARM,Accessories,3.0,14.85
90049,IVORY GOLD METAL BAG CHARM,Accessories,5.0,34.77
90094,NECKLACE+BRACELET SET FRUIT SALAD,Decor,14.0,35.699999999999996
90096,NECKLACE+BRACELET SET BLUE BLOSSOM,Decor,45.0,112.21
90099,NECKLACE+BRACELET SET BLUE HIBISCUS,Decor,27.0,76.38
90100,NECKLACE+BRACELET SET PINK DAISY,Decor,1.0,2.55
90114,SUMMER DAISIES BAG CHARM,Accessories,225.0,417.96
90115,SUMMER BUTTERFLIES BAG CHARM,Accessories,54.0,134.53
90116,FRUIT SALAD BAG CHARM,Accessories,64.0,145.52
90118,PINK DAISY BAG CHARM,Accessories,36.0,89.94
90119,METALIC LEAVES BAG CHARMS,Accessories,83.0,205.06
90123A,PINK HEART OF GLASS BRACELET,Decor,15.0,89.12
90123B,TURQUOISE HEART OF GLASS BRACELET,Decor,9.0,53.42
90123C,GREEN HEART OF GLASS BRACELET,Decor,14.0,83.29
90123D,WHITE HEART OF GLASS BRACELET,Decor,6.0,35.31
90125A,PINK BERTIE GLASS BEAD BAG CHARM,Accessories,167.0,106.24
90125B,AQUA BERTIE GLASS BEAD BAG CHARM,Accessories,30.0,48.06
90125D,PURPLE BERTIE GLASS BEAD BAG CHARM,Accessories,147.0,110.03
90125E,AMBER BERTIE GLASS BEAD BAG CHARM,Accessories,11.0,21.05
90129A,PINK GLASS TASSLE BAG CHARM,Accessories,45.0,82.98
90129B,TURQUOISE GLASS TASSLE BAG CHARM,Accessories,57.0,121.38
90129C,GREEN GLASS TASSLE BAG CHARM,Accessories,35.0,79.76
90129D,AMBER GLASS TASSLE BAG CHARM,Accessories,14.0,33.440000000000005
90129E,PURPLE GLASS TASSLE BAG CHARM,Accessories,42.0,77.03999999999999
90129F,RED GLASS TASSLE BAG CHARM,Accessories,40.0,88.03
90132,LIGHT TOPAZ TEAL/AQUA COL NECKLACE,Kitchen,3.0,15.16
90133,TEAL/FUSCHIA COL BEAD NECKLACE,Kitchen,19.0,94.43
90167,BEADED LOVE HEART JEWELLERY SET,Decor,10.0,8.5
90197B,BLACK GLASS BRACELET W HEART CHARMS,Decor,35.0,174.73000000000002
90200A,PURPLE SWEETHEART BRACELET,Decor,78.0,328.44
90200B,BLACK SWEETHEART BRACELET,Decor,94.0,397.08
90200C,BLUE SWEETHEART BRACELET,Decor,50.0,211.43
90200D,PINK SWEETHEART BRACELET,Decor,175.0,725.32
90200E,GREEN SWEETHEART BRACELET,Decor,103.0,423.41
DCGS0004,HAYNES CAMPER SHOULDER BAG,Accessories,1.0,16.63
DCGSSBOY,BOYS PARTY BAG,Accessories,47.0,150.54999999999998
DCGSSGIRL,GIRLS PARTY BAG,Accessories,47.0,144.43
